{
  "description": "All UvA Catalogue Datasets combined, except Beeldbank/Image Repository. Contains data on books, incunabula, letters, maps, images, video, audio, sheet music, archaeological and other objects.",
  "id": "607d856b2cc564036798aca8",
  "name": "Catalogue",
  "displayName": "Catalogue",
  "owner": {
    "avatarUrl": "https://lod.uba.uva.nl/imgs/avatars/a/603d08116297330357f9e2eb.png?v=5",
    "accountName": "UB-UVA",
    "uid": "603d08116297330357f9e2eb",
    "name": "Library of the University of Amsterdam",
    "description": "Bibliotheek van de Universiteit van Amsterdam. Datasets made available under the Public Domain Dedication and License v1.0 (PDDL), except WorldCat-derived data under the ODC Attribution License.",
    "createdAt": "2021-03-01T15:28:17.349Z",
    "type": "org",
    "accountType": "group"
  },
  "accessLevel": "public",
  "createdAt": "2021-04-19T13:28:11.695Z",
  "updatedAt": "2026-06-03T22:28:30.982Z",
  "graphCount": 11,
  "statements": 79167066,
  "serviceCount": 2,
  "assetCount": 0,
  "graphsToSaveTo": {
    "dataModelGraph": "https://lod.uba.uva.nl/UB-UVA/Catalogue/graphs/default",
    "editorResourcesGraph": "https://lod.uba.uva.nl/UB-UVA/Catalogue/graphs/default"
  },
  "tags": [],
  "prefixes": [
    { "prefixLabel": "graph", "iri": "https://uba.uva.triply.cc/UB-UVA/ALL/graphs/", "scope": "local" },
    { "prefixLabel": "edm", "iri": "http://www.europeana.eu/schemas/edm/", "scope": "local" }
  ],
  "lastGraphsUpdateTime": "2026-06-03T22:28:30.958Z",
  "exampleResources": [],
  "hasDataQualityIssues": true,
  "autogeneratedIdType": "uuid",
  "toggles": {
    "browserUi": true,
    "tableUi": true,
    "dataEditorUi": true,
    "dataModelEditorUi": true,
    "insightsUi": true,
    "sparqlIdeUi": true,
    "graphqlUi": true,
    "elasticsearchUi": true,
    "graphsUi": true,
    "servicesUi": true,
    "assetsUi": true
  }
}
